{
  "version": 2,
  "stateNamespace": "m4-ledger-v2",
  "stateKey": {
    "headRepository": "SolusQuest/agentic-pr-review",
    "namespace": "m4-ledger-v2",
    "pullRequest": 48,
    "repository": "SolusQuest/agentic-pr-review",
    "trustedExecutionDomain": "trusted",
    "workflowIdentity": "agentic-pr-review"
  },
  "sessionEpoch": "S00000000000000000000A",
  "cacheContractIdentity": {
    "adapterId": "ae1eae1d76e5b7c865c4122ce366a08025842566d2d96c75cc13e6353a73db0d",
    "cacheConfigId": "e1630a47c2ed20d5d5fb9dc526ad79f265566f202ca2a30acde59225daf8120f",
    "ledgerSchemaVersion": 1,
    "modelId": "claude-sonnet-4-20250514",
    "policyId": "823412d1eacb67956220e532959f0104603057c88704863ca38e7cd188fda812",
    "prefixContractVersion": 1,
    "providerId": "anthropic",
    "templateId": "5cde0f1298f41f7d1c8b907a36992a7a513225a2615bd6e307bf1a9149b06b40",
    "toolDefinitionId": "f9d35d43770d39092a663e665e82ae1d84a9e0da3d0d10c407acada6a40cd281"
  },
  "generation": {
    "ledgerEpoch": "AAAAAAAAAAAAAAAAAAAAAA",
    "stateGeneration": 4
  },
  "transition": {
    "kind": "continuation",
    "predecessorLedgerEpoch": "AAAAAAAAAAAAAAAAAAAAAA",
    "predecessorLedgerSha256": "23d1f0cbe23d7da3091a760a87d96aeb3cf97265d2cfaff1e8e7efde55647314",
    "predecessorManifestSha256": "3617c38e50be29690c7072d5af864d898e1016bcc05fdaa3767a67c68b62a371",
    "predecessorStateGeneration": 3
  },
  "provenance": {
    "currentBaseRef": "refs/heads/main",
    "currentBaseSha": "bbbbbbbbbbbbbbbbbbbbbbbbbbbbbbbbbbbbbbbb",
    "currentHeadSha": "aaaaaaaaaaaaaaaaaaaaaaaaaaaaaaaaaaaaaaaa",
    "producedAt": "2026-07-14T00:00:00Z",
    "producingActionSourceSha": "cccccccccccccccccccccccccccccccccccccccc",
    "producingGitRef": "refs/pull/48/merge",
    "producingRunAttempt": 1,
    "producingRunId": "123456789",
    "producingWorkflowRef": "SolusQuest/agentic-pr-review/.github/workflows/review.yml@refs/heads/main",
    "reviewedBaseRef": "refs/heads/main",
    "reviewedBaseSha": "bbbbbbbbbbbbbbbbbbbbbbbbbbbbbbbbbbbbbbbb",
    "reviewedHeadSha": "aaaaaaaaaaaaaaaaaaaaaaaaaaaaaaaaaaaaaaaa",
    "workflowEvent": "pull_request"
  },
  "transaction": {
    "consumedInputSha256": "c96c6d5be8d08a12e7b5cdc1b207fa6b2430974c86803d8891675e76fd992c20",
    "interactionId": "167d4b09d014f218c42abf5ebb397a2fc819401fe709223fbd729f1f8e9e790e",
    "interactionOrdinal": 4,
    "metadataSemanticSha256": "c1ab16b523fba54343ae1920856b575a720c6071bf90e51c1b95f188101e19b5",
    "resultSha256": "f6a214f7a5fcda0c2cee9660b7fc29f5649e3c68aad48e20e950137c98913a68",
    "traceSha256": "eafe895eb8119e6e5d06463590b2ef81b3651c157d5c8e18f1889186c7fd0ac0",
    "candidateLedgerSha256": "90a284af8449eaba44a23ee262ee76c08e80da81d379769182be5aab503d8b33"
  },
  "ledger": {
    "path": "ledger.json",
    "sha256": "90a284af8449eaba44a23ee262ee76c08e80da81d379769182be5aab503d8b33",
    "bytes": 28,
    "schemaVersion": 1
  },
  "providerRunMetadata": {
    "path": "provider-run-metadata.json",
    "sha256": "f7e06a6e85d827cd38a60ce3d0bc4726c0b49fa82b7527911bbacf48cd5c431f",
    "bytes": 30,
    "schemaVersion": 1,
    "producingGeneration": {
      "ledgerEpoch": "AAAAAAAAAAAAAAAAAAAAAA",
      "sessionEpoch": "S00000000000000000000A",
      "stateGeneration": 4
    }
  }
}